policy_id,policy_country_iso_code,policy_title,policy_name,policy_jurisdiction,policy_supranational_region,policy_country,policy_subnational_region_or_state,policy_city,policy_type_of_policy_instrument,policy_sector_name,policy_description,policy_type,policy_stringency,policy_implementation_state,policy_date_of_decision,policy_start_date_of_implementation,policy_end_date_of_implementation,policy_high_impact,policy_objective,policy_source_or_references,policy_last_updated,impact_indicator_comments,impact_indicator_name_of_impact_indicator,impact_indicator_value,impact_indicator_base_year,impact_indicator_target_year
220205881.0,EGY,Target to increase agricultural production by 30% in 2024 Egypt (2021),Target to increase agricultural production by 30% in 2024,Country,,Egypt,,,,AFOLU,"Egypt aims to increase the gross domestic product (GDP) contribution of its agriculture sector to 12 percent by 2024, in addition to increasing agricultural production by 30 percent by 2024, according to Minister of Planning and Economic Development Hala El-Said.",,,In force,2021.0,,,,Mitigation,https://www.egypttoday.com/Article/3/105279/Egypt-targets-to-increase-agricultural-production-by-30-in-2024,44678,,,,,
220205884.0,EGY,Vehicle conversion to CNG initiative Egypt (2022),Vehicle conversion to CNG initiative,Country,,Egypt,,,"Fiscal or financial instruments, Grants and subsidies","Transport, Light-duty vehicles, Low-emissions mobility","This initiative supports the adaptation of traditional ICE vehicles to run on CNG by subsidzing up to 10% of the cost. The target is to convert 260,000 vehicles in three years, almost doubling the current CNG-fueled car fleet in the country.",Other low-carbon technologies and fuel switch,,In force,2022.0,,,,Mitigation,http://www.mti.gov.eg/English/MediaCenter/News/Pages/Car-conversion-initiative-starts-by-end-March--Ministers.aspx,44678,,,,,
220205891.0,IND,Urban infrastructure investment India (2022),Urban infrastructure investment,Country,,India,,,Investment,Transport,The Union's Budget for 2022/2023 includes investments in urban bus and metro networks,"Energy service demand reduction and resource efficiency, Other low-carbon technologies and fuel switch",,In force,2022.0,,,Unknown,Mitigation,https://www.indiabudget.gov.in/doc/Budget_Speech.pdf,44593,,,,,
220205914.0,MEX,"Policy for realibility, safety, quality, and continuity of the National Electric System Mexico (2020)","Policy for realibility, safety, quality, and continuity of the National Electric System (2020)",Country,,Mexico,,,,,,,,In force,2020.0,,,High,Mitigation,http://dof.gob.mx/nota_detalle.php?codigo=5593425&fecha=15/05/2020,44659,,,,,
220205879.0,COL,"Law 2,169 on low carbon development Colombia (2021)","Law 2,169 on low carbon development",Country,,Colombia ,,,"Policy support, Strategic planning, regulatory instruments, Codes and standards, Target",General,"Define the minimum intersectional goals and measures for the short, medium, and long time required to achieve the carbon neutrality climate resilience, and the low carbon development.","Energy efficiency, Energy service demand reduction and resource efficiency, Non-energy use, Other low-carbon technologies and fuel switch, Renewables",,In force,2021.0,,,,Mitigation,https://dapre.presidencia.gov.co/normativa/normativa/LEY%202169%20DEL%2022%20DE%20DICIEMBRE%20DE%202021.pdf,44678,,,,,
220205893.0,IDN,Rooftop Solar MEMR Regulation 26/2021 Indonesia (2021),Rooftop Solar MEMR Regulation 26/2021,Country,,Indonesia,,,"Fiscal or financial incentives, Tendering schemes, Targets","Electricity and heat, Renewables","This latest amendment to MEMR Regulation 49/2018 (as previously amended by MEMR Regulation 16/2019) improves the governance and economics of rooftop solar PV. The main refinements are (1) export provision of electricity increases from 65% to 100%, (2) excess accumulated difference in bills extended from 3 months to 6 months, (3) application period shortened to 5 days, (4) application mechanism introduced to ease submission, reporting, and supervision of Rooftop solar PV program, (5) opportunity for carbon trading from rooftop solar PV, (6) complaint centre opened for rooftop solar PV customers, and (7) arrangement extended to include non-PLN customers (IUPTLU Holders).  ",Renewables,,In force,2022.0,,,Unknown,Mitigation,https://www.esdm.go.id/id/media-center/arsip-berita/implementasi-peraturan-menteri-esdm-tentang-plts-atap,44659,,,,,
220205896.0,IDN,New Carbon Law Indonesia (2021),New Carbon Law,Country,,Indonesia,,,"Market-based instruments, GHG emission reduction crediting and offsetting mechanism, fiscal or financial incentives, CO2 taxes",General,"Indonesias sweeping new carbon regulations introduce a general carbon tax policy, a general carbon economic value, sector-based emission caps, and a carbon trading framework.",Energy service demand reduction and resource efficiency,,In force,2021.0,,,,Mitigation,https://hsfnotes.com/indonesia/2021/12/16/introducing-indonesias-new-carbon-law/,44678,,,,,
